Topics,Definition
Accounting,"Accounting or accountancy is the measurement, processing, and communication of financial and non financial information about economic entities such as businesses and corporations. Accounting, which has been called the ""language of business"", measures the results of an organization's economic activities and conveys this information to a variety of users, including investors, creditors, management, and regulators."
Analytics,"Analytics is the systematic computational analysis of data or statistics. It is used for the discovery, interpretation, and communication of meaningful patterns in data. It also entails applying data patterns towards effective decision making. It can be valuable in areas rich with recorded information; analytics relies on the simultaneous application of statistics, computer programming and operations research to quantify performance."
Assessing Performance,Assessing Performance is defined as a formal and productive procedure to measure an employee’s work and results based on their job responsibilities.
Auditing,"An audit is an ""independent examination of financial information of any entity, whether profit oriented or not, irrespective of its size or legal form when such an examination is conducted with a view to express an opinion thereon.” Auditing also attempts to ensure that the books of accounts are properly maintained by the concern as required by law. \"
Balanced Scorecard,balanced scorecard refers to a strategic management performance metric used to identify and improve various internal business functions and their resulting external outcomes.
Behavioral Economics,"a method of economic analysis that applies psychological insights into human behaviour to explain economic decision-making. Behavioral models typically integrate insights from psychology, neuroscience and microeconomic theory. The study of behavioral economics includes how market decisions are made and the mechanisms that drive public choice."
Boards,The board is a governing body that typically meets at regular intervals to set policies for corporate management and oversight. Every public company must have a board of directors. Some private and nonprofit organizations also have a board of directors.
Branding,"The promotion of a particular product or company by means of advertising and distinctive design. Brand, a name, logo, slogan, and/or design scheme associated with a product or service
Branding (promotional), the distribution of merchandise with a brand name or symbol imprinted"
Budgeting,"financial plan for a defined period, often one year. It may also include planned sales volumes and revenues, resource quantities, costs and expenses, assets, liabilities and cash flows. Companies, governments, families, and other organizations use it to express strategic plans of activities or events in measurable terms. A budget is the sum of finances allocated for a particular purpose and the summary of intended expenditures along with proposals for how to meet them. It may include a budget surplus, providing money for use at a future time, or a deficit in which expenses exceed income."
Business Education,"Business education is a branch of education that involves teaching the skills and operations of the business industry. A business education has many components, as there are many different areas of the business industry as a whole. An education in business varies greatly in its curriculum and popularity around the world. Career development is often an integral part of an education in business."
Business History,"Business history is a historiographical field which examines the history of firms, business methods, government regulation and the effects of business on society. It also includes biographies of individual firms, executives, and entrepreneurs. It is related to economic history. It is distinct from ""company history"" which refers to official histories, usually funded by the company itself."
Business Law,"Commercial law or business law is the body of law which governs business and commerce and is often considered to be a branch of civil law and deals both with issues of private law and public law. Commercial law regulates corporate contracts, hiring practices, and the manufacture and sales of consumer goods."
Business Models,"a plan for the successful operation of a business, identifying sources of revenue, the intended customer base, products, and details of financing."
Business Processes,"A business process, business method or business function is a collection of related, structured activities or tasks by people or equipment in which a specific sequence produces a service or product (serves a particular business goal) for a particular customer or customers. A business process may often be visualized (modeled) as a flowchart of a sequence of activities with interleaving decision points or as a process matrix of a sequence of activities with relevance rules based on data in the process. The benefits of using business processes include improved customer satisfaction and improved agility for reacting to rapid market change. "
Business Writing,"It is a type of writing that is used in a professional setting. It is a purposeful piece of writing that conveys relevant information to the reader in a clear, concise, and effective manner. It includes client proposals, reports, memos, emails."
Career Planning,"Career planning refers to the strategy a person uses to determine career goals and the path to achieve those goals. The process integrates various activities, including steps for self-improvement and the process of meeting these goals."
Change Management,"Change management is a collective term for all approaches to prepare, support, and help individuals, teams, and organizations in making organizational change. Drivers of change may include the ongoing evolution of technology, internal reviews of processes, crisis response, customer demand changes, competitive pressure, acquisitions and mergers, and organizational restructuring. It includes methods that redirect or redefine the use of resources, business process, budget allocations, or other modes of operation that significantly change a company or organization. "
Coaching,"Coaching is a form of development in which an experienced person, called a coach, supports a learner or client in achieving a specific personal or professional goal by providing training and guidance. The learner is sometimes called a coachee. Occasionally, coaching may mean an informal relationship between two people, of whom one has more experience and expertise than the other and offers advice and guidance as the latter learns; but coaching differs from mentoring by focusing on specific tasks or objectives, as opposed to more general goals or overall development."
Collaboration,"Collaboration is the process of two or more people, entities or organizations working together to complete a task or achieve a goal. Collaboration is similar to cooperation. Most collaboration requires leadership, although the form of leadership can be social within a decentralized and egalitarian group. Teams that work collaboratively often access greater resources, recognition and rewards when facing competition for finite resources.Structured methods of collaboration encourage introspection of behavior and communication. Such methods aim to increase the success of teams as they engage in collaborative problem-solving."
Communication,"act of developing meaning among entities or groups through the use of sufficiently mutually understood signs, symbols, and semiotic conventions."
Compensation,"something, typically money, awarded to someone in recognition of loss, suffering, or injury"
Competition,"Competition arises whenever two or more parties strive for a common goal which cannot be shared: where one's gain is the other's loss (an example of which is a zero-sum game). Competition includes rivalry between entities such as organisms, individuals, economic and social groups, etc. The rivalry can be over attainment of any exclusive goal, including recognition: (e.g. awards, goods, mates, status, prestige), leadership, market share, niches and scarce resources, or a territory."
Competitive Strategy,A competitive strategy may be defined as a long-term plan of action that a company devises towards achieving a competitive advantage over its competitors after examining the strengths and weaknesses of the latter and comparing them to its own.
Conflict,"A conflict is a clash of interest. The basis of conflict may vary but it is always a part of society. Basis of conflict may be personal, racial, class, caste, political and international. Conflict in groups often follows a specific course."
Corporate Communications,the way in which businesses and organizations communicate with internal and external various audiences. These audiences commonly include: Customers and potential customers. Employees. Key stakeholders
Corporate Governance,"it is the structure of rules, practices, and processes used to direct and manage a company. A company's board of directors is the primary force influencing corporate governance."
Costs,"A cost is the value of money that has been used up to produce something or deliver a service, and hence is not available for use anymore. In business, the cost may be one of acquisition, in which case the amount of money expended to acquire it is counted as cost. In the field of economics, cost is a metric that is totaling up as a result of a process or as a differential for the result of a decision."
Creativity,"The use of imagination or original ideas to create something; inventiveness. Creativity is a phenomenon whereby something somehow new and somehow valuable is formed. The created item may be intangible (such as an idea, a scientific theory, a musical composition, or a joke) or a physical object (such as an invention, a printed literary work, or a painting)."
Crisis Communication,The effort taken by an organization to communicate with the public and stakeholders when an unexpected event occurs that could have a negative impact on the organization's reputation. This can also refer to the efforts to inform employees or the public of a potential hazard which could have a catastrophic impact. 
Crisis Management,Crisis management is the process by which an organization deals with a disruptive and unexpected event that threatens to harm the organization or its stakeholders.  It is considered to be the most important process in public relations.
Cross-Cultural Management,It is the study of management in a cross-cultural context. It includes the study of the influence of societal culture on managers and management practice as well as the study of the cultural orientations of individual managers and organization members.
Currency,"A currency in the most specific sense is money in any form when in use or circulation as a medium of exchange, especially circulating banknotes and coins. It is a system of money (monetary units) in common use, especially for people in a nation."
Customer Service,"Customer service is the provision of service to customers before, during, and after a purchase. The perception of success of such interactions is dependent on employees ""who can adjust themselves to the personality of the guest"". It concerns the priority an organization assigns to customer service relative to components such as product innovation and pricing. In this sense, an organization that values good customer service may spend more money in training employees than the average organization or may proactively interview customers for feedback."
Customers,"In sales, commerce and economics, a customer (sometimes known as a client, buyer, or purchaser) is the recipient of a good, service, product or an idea - obtained from a seller, vendor, or supplier via a financial transaction or exchange for money or some other valuable consideration."
Data,"Data are units of information, often numeric, that are collected through observation."
Decision Making,"decision-making is regarded as the cognitive process resulting in the selection of a belief or a course of action among several possible alternative options, it could be either rational or irrational."
Delegation,"Delegation is the assignment of authority to another person (normally from a manager to a subordinate) to carry out specific activities. It is the process of distributing and entrusting work to another person. Delegation is one of the core concepts of management leadership. The process involves managers deciding which work they should do themselves and which work should be delegated to others for completion. From a managerial standpoint, delegation involves shifting project responsibility to team members, giving them the opportunity to finalize the work product effectively, with minimal intervention. Delegation empowers a subordinate to make decisions."
Demographics,"Demographic analysis is the study of a population based on factors such as age, race, and sex. Demographic data refers to socioeconomic information expressed statistically including employment, education, income, marriage rates, birth and death rates, and more."
Design,"a plan or drawing produced to show the look and function or workings of a building, garment, or other object before it is made."
Developing Employees,"Process of working with employees to improve, enhance, refine and hone existing skills, and to also develop newer ones, in support of the organization’s mission and goals"
Difficult Conversations,"A difficult conversation is any situation where the needs/wants, opinions or perceptions of the involved parties are diverse, with their feelings and emotions running strong."
Disruptive Innovation,"disruptive innovation is an innovation that creates a new market and value network and eventually disrupts an existing market and value network, displacing established market-leading firms, products, and alliances."
Diversity,"Diversity is the range of human differences, including but not limited to race, ethnicity, gender, gender identity, sexual orientation, age, social class, physical ability or attributes, religious or ethical values system, national origin, and political beliefs."
Downsizing,"Downsizing is the permanent reduction of a company's labor force through the elimination of unproductive workers or divisions. Downsizing is a common organizational practice, usually associated with economic downturns and failing businesses."
Economic Development,"Economic Development is the creation of wealth from which community benefits are realized. It is more than a jobs program, it's an investment in growing your economy and enhancing the prosperity and quality of life for all residents."
Economics,"Economics is the social science that studies how people interact with value; in particular, the production, distribution, and consumption of goods and services. Economics focuses on the behaviour and interactions of economic agents and how economies work."
Economics & Society,"Society is an entity composed of individuals, groups, and organizations. seeking to stay together by sharing traditions, values, languages, interests, and. other things. An economy is a space within which most members of society. interact with each other and with their environment to improve the quality."
Economy,"An economy is an area of the production, distribution and trade, as well as consumption of goods and services by different agents. In general, it is defined 'as a social domain that emphasize the practices, discourses, and material expressions associated with the production, use, and management of resources'."
Education,"Education is the process of facilitating learning, or the acquisition of knowledge, skills, values, morals, beliefs, and habits."
Emerging Markets,the economy of a developing nation that is becoming more engaged with global markets as it grows
Emotional Intelligence,"is the ability to understand, use, and manage your own emotions in positive ways to relieve stress, communicate effectively, empathize with others, overcome challenges and defuse conflict or refers to the capability of a person to manage and control his or her emotions and possess the ability to control the emotions of others as well. In other words, they can influence the emotions of other people also."
Employee Retention,"Employee retention refers to the ability of an organization to retain its employees. Employee retention can be represented by a simple statistic. However, many consider employee retention as relating to the efforts by which employers attempt to retain the employees in their workforce."
Entrepreneurial Finance,"it is the study of value and resource allocation, applied to new ventures. It addresses key questions which challenge all entrepreneurs: how much money can and should be raised; when should it be raised and from whom; what is a reasonable valuation of the startup; and how should funding contracts and exit decisions be structured."
Entrepreneurial Management,practice of taking entrepreneurial knowledge and utilizing it for increasing the effectiveness of new business venturing as well as small- and medium-sized businesses.
Entrepreneurship,"Entrepreneurship is the creation or extraction of value. With this definition, entrepreneurship is viewed as change, generally entailing risk beyond what is normally encountered in starting a business, which may include other values than simply economic ones."
Ethics,moral principles that govern a person's behaviour or the conducting of an activity.
Executive Compensation,Executive compensation is composed of both the financial compensation and other non-financial benefits received by an executive from their employing firm in return for their service.
Experimentation,"An experiment is a procedure carried out to support, refute, or validate a hypothesis. Experiments provide insight into cause-and-effect by demonstrating what outcome occurs when a particular factor is manipulated."
Finance & Accounting,"Financial accounting is the field of accounting concerned with the summary, analysis and reporting of financial transactions related to a business. This involves the preparation of financial statements available for public use."
Financial Analysis,"the process of evaluating businesses, projects, budgets, and other finance-related transactions to determine their performance and suitability. Typically, financial analysis is used to analyze whether an entity is stable, solvent, liquid, or profitable enough to warrant a monetary investment."
Financial Management,"means planning, organizing, directing and controlling the financial activities such as procurement and utilization of funds of the enterprise. It means applying general management principles to financial resources of the enterprise."
Financial Markets,"refer broadly to any marketplace where the trading of securities occurs, including the stock market, bond market, forex market, and derivatives market, among others."
Firing,"Termination of employment is an employee's departure from a job and the end of an employee's duration with an employer. Termination may be voluntary on the employee's part, or it may be at the hands of the employer, often in the form of dismissal or a layoff."
Forecasting,It is a technique that uses historical data as inputs to make informed estimates that are predictive in determining the direction of future trends. 
Founders,someone who establishes an organization
Gender,"either of the two sexes (male and female), especially when considered with reference to social and cultural differences rather than biological ones. The term is also used more broadly to denote a range of identities that do not correspond to established ideas of male and female."
Generational Issues,"Differences and disconnect between generations, or the generation gap, can result in a variety of issues, such as miscommunication and family strife."
Giving Feedback,"Feedback is a way of learning for each and every person of the organization. It is a two-way process in which everyone tries to learn something positive from the other person's suggestions. It is all about mutual understanding, respecting each other's opinions, and learning something from each other's experiences."
Global Strategy,A global strategy is one that a company takes when it wants to compete and expand in the global market
Globalization,"Globalization, or globalisation is the process of interaction and integration among people, companies, and governments worldwide. Globalization has accelerated since the 18th century due to advances in transportation and communication technology. This increase in global interactions has caused a growth in international trade and the exchange of ideas, beliefs, and culture. Globalization is primarily an economic process of interaction and integration that is associated with social and cultural aspects. "
Government,"A government is the system or group of people governing an organized community, generally a state. In the case of its broad associative definition, government normally consists of legislature, executive, and judiciary."
Growth Strategy,A growth strategy is an organization's plan for overcoming current and future challenges to realize its goals for expansion
Health,"Health is a state of physical, mental and social well-being in which disease and infirmity are absent."
Hiring,"Refers to the overall process of identifying, attracting, screening, shortlisting, and interviewing suitable candidates for jobs within an organization. Recruitment can also refer to processes involved in choosing individuals for unpaid roles."
Human Resource Management,Human resource management is the strategic approach to the effective management of people in a company or organization such that they help their business gain a competitive advantage. It is designed to maximize employee performance in service of an employer's strategic objectives.
Influence,"the capacity to have an effect on the character, development, or behaviour of someone or something, or the effect itself."
Informal Leadership,"An informal leader is an individual within an organization who is worth listening to because of their perceived experience and reputation among peers. They influence the decisions of others, although they hold no formal position of authority and have no power over those who choose to follow their lead."
Innovation,Innovation is the practical implementation of ideas that result in the introduction of new goods or services or improvement in offering goods or services.
Intellectual Property,"Intellectual property is a category of property that includes intangible creations of the human intellect. There are many types of intellectual property, and some countries recognize more than others. The most well-known types are copyrights, patents, trademarks, and trade secrets."
International Business,"International business refers to the trade of goods, services, technology, capital and/or knowledge across national borders and at a global or transnational scale. It involves cross-border transactions of goods and services between two or more countries."
Internet,"The Internet is a vast network that connects computers all over the world. Through the Internet, people can share information and communicate from anywhere with an Internet connection."
IPO,An initial public offering or stock market launch is a public offering in which shares of a company are sold to institutional investors and usually also retail investors.
IT,"It refers to anything related to computing technology, such as networking, hardware, software, the Internet, or the people that work with these technologies."
Job Search,"It is the act of looking for employment, due to unemployment, underemployment, discontent with a current position, or a desire for a better position."
Joint Ventures,"A joint venture is a business entity created by two or more parties, generally characterized by shared ownership, shared returns and risks, and shared governance"
Knowledge Management,"Knowledge management is the process of creating, sharing, using and managing the knowledge and information of an organization. It refers to a multidisciplinary approach to achieve organisational objectives by making the best use of knowledge."
Labor,"Labor, usually referred to as paid work, paid employment, or paid labour, refers to the socioeconomic relationship between a worker and an employer in which the worker sells their labour power under a formal or informal employment contract."
Leadership,"Leadership is both a research area, and a practical skill encompassing the ability of an individual, group or organization to ""lead"", influence or guide other individuals, teams, or entire organizations."
Leadership & Managing People,"A practical skill encompassing the ability of an individual, group or organization to ""lead"", influence or guide other individuals, teams, or entire organizations. Managing people is the ability to understand and know what each of their subordinate employee's tasks are and how to work with each employee in working toward successful completion of such tasks."
Leadership Development,"Leadership development is the process which helps expand the capacity of individuals to perform in leadership roles within organizations. Leadership roles are those that facilitate execution of an organization's strategy through building alignment, winning mindshare and growing the capabilities of others"
Leadership Transitions,"significant change in a leader's role caused by promotion, secondment, changing organisations, merger, acquisition, restructure or returning from maternity/paternity/career leave."
