"Accounting or Accountancy is the measurement, processing, and communication of financial and non financial information about economic entities[1][2] such as businesses and corporations. Accounting, which has been called the ""language of business"",[3] measures the results of an organization's economic activities and conveys this information to a variety of users, including investors, creditors, management, and regulators.[4] Practitioners of accounting are known as accountants. The terms ""accounting"" and ""financial reporting"" are often used as synonyms.

Accounting can be divided into several fields including financial accounting, management accounting, external auditing, tax accounting and cost accounting.[5][6] Accounting information systems are designed to support accounting functions and related activities. Financial accounting focuses on the reporting of an organization's financial information, including the preparation of financial statements, to the external users of the information, such as investors, regulators and suppliers;[7] and management accounting focuses on the measurement, analysis and reporting of information for internal use by management.[1][7] The recording of financial transactions, so that summaries of the financials may be presented in financial reports, is known as bookkeeping, of which double-entry bookkeeping is the most common system",Finance & Accounting,Accounting,Business Education,Business Education,,,,,,,,
"When you do talk to others about the obstacles they’ve faced, start by requesting their permission. If it’s granted, approach with humility and a learning mindset. Good questions include:

I’m curious about the things women/people of color/women of color in this organization find most challenging day-to-day—things that I might not notice. Would you feel comfortable sharing some of what you encounter?
If there was one thing you wish your white male colleagues would do more of to improve the experience of women/people of color/women of color, what would it be?
If there was one thing we could stop doing every day, what would it be?
If you were giving me advice on how to really show up as a colleague to make the workplace fair and welcoming, what would you say?
Recognize that members of an underrepresented group won’t all have the same experiences—especially if they’re from different cohorts. For example, white women’s experiences aren’t necessarily similar to those of women of color, who, all our research shows, are particularly marginalized and silenced in organizations. Don’t generalize from the stories of one or two colleagues.",Social Responsibility,Race,Ethics,Organization,,,,,,,,
"Allies can broaden their impact by joining or forming groups of colleagues interested in fighting racism and gender inequality. Look for like-minded people in all parts of your organization, including other units, satellite and remote locations, and employee resource groups, and then grow your base. Focus your advocacy on evidence-based tactics that will drive small wins within your sphere of influence, and create opportunities to interact through networking, mentoring, and professional development events.
If you’re a senior leader, you should push for organizational change. No matter where your organization is on its DEI journey, you can champion and lend time and energy to designing and implementing antibias, recruitment, and leadership development initiatives that work. Iris Bohnet has found that DEI efforts are most successful when leaders clarify their purpose and goals and are transparent about plans and progress. According to Andrew Behar, the CEO of As You Sow, companies that do this will attract and retain the best and brightest employees and reduce risk to shareholders. And we have observed that effective senior allies not only set an example but also outline expectations for everyone’s behavior and link outcomes to responsibilities and rewards.",Social Responsibility,Sexual Orientation,Gender,,,,,,,,,
"Allies seek out talented protégés from entirely different racial and cultural backgrounds and become their vocal fans. They get to know these colleagues’ strengths and weaknesses, help them develop as leaders, challenge and encourage them, and tout their abilities and achievements whenever new projects, stretch assignments, or promotions are discussed. They nominate protégés on the basis of their potential, without expecting them to prove they can do a job in advance. This usually requires putting some social capital on the line—a risk sponsors need to get more comfortable with. Finally, allies introduce protégés to key players in their own professional networks to open up an even broader set of opportunities for them. In Tsedale’s research, sponsorship was shown to be critical to Black women’s access to significant training, development, and networking opportunities and advancement. Unfortunately, many white men picked protégés who looked just like them. As Fotoula, a fifth-year law associate without a sponsor, noted, “I think where [the lack of mentorship] really played a role was in not having…people to say, ‘Make sure you’re at the event. Make sure you speak up and say this. Make sure that you ask about this,’ or ‘You know what? I heard about a deal that’s happening at such and such. I’m going to make sure this partner knows that you’re interested.’ I’m not saying I was entitled to it,” she continued, “but…I know that would have made a difference.”",Race,Social Responsibility,Networking,Innovation,,,,,,,,
"It is important to emphasize that interior design is a specialized branch of architecture or environmental design; it is equally important to keep in mind that no specialized branch in any field would be very meaningful if practiced out of context. The best buildings and the best interiors are those in which there is no obvious disparity between the many elements that make up the totality. Among these elements are the structural aspects of a building, the site planning, the landscaping, the furniture, and the architectural graphics (signs), as well as the interior details. Indeed, there are many examples of distinguished buildings and interiors that were created and coordinated by one guiding hand. Because of the technological complexity of contemporary planning and building, it is no longer possible for a single architect or designer to be an expert in all the many aspects that make up a modern building. It is essential, however, that the many specialists who make up a team be able to communicate with each other and have sufficient basic knowledge to carry out their common goals. While the architect usually concerns himself with the overall design of buildings, the interior designer is concerned with the more intimately scaled aspects of design, the specific aesthetic, functional, and psychological questions involved, and the individual character of spaces.",Design,Creativity,Technology,,,,,,,,,
"We’ve pondered the question ‘why is financial reporting important?’, looked at real-world use cases, and shared what we consider to be the financial reporting meaning. To continue our journey, let’s consider the key benefits of financially-based reporting and analytics.

Improved debt management: As you know, debt can cripple the progress of any company, regardless of sector. While there may be many different types of financial reporting concerning purpose or software, almost all solutions will help you track your current assets divided by the current liabilities on your balance sheet to help gauge your liquidity and manage your debts accordingly.
Trend identification: Regardless of what area of financial activity you’re looking to track, this kind of reporting will help you identify trends, both past and present, which will empower you to tackle any potential weaknesses while helping you make improvements that will benefit the overall health of your business.
Real-time tracking:  By gaining access to centralized, real-time insights, you will be able to make accurate, informed decisions swiftly, thereby avoiding any potential roadblocks while maintaining your financial fluidity at all times.
Liabilities: Managing your liabilities is a critical part of your company’s ongoing financial health. Business loans, credit lines, credit cards, and credit extended from vendors are all integral liabilities to manage. By using a financial report template, if you're planning to apply for a business expansion loan, you can explore financial statement data and determine if you need to reduce existing liabilities before making an official application.
Progress and compliance: As the information served up by financial reporting software is both accurate and robust, not only does access to this level of analytical reporting offer an opportunity to improve your financial efficiency over time, but it will also ensure you remain 100% compliant – which is essential if you want your business to remain active.
Cash flow: Big or small, an organization’s cash flow is essential to its ongoing financial health. Working with a mix of detailed metrics and KPIs, it’s possible to drill down into cash flow in relation to anticipated profit and liabilities, keeping your monetary movements secure and fluent in the process.
Communication & data access: Any modern financial analysis report worth its salt is accessible to and optimized for a multitude of devices. By gaining unlimited access to essential financial insights and data, you can respond to challenges swiftly while improving internal communication across the board. If everyone understands emerging trends and can share vital financial data, your organization will become more efficient, more innovative, and safeguarded against potential compliance issues or errors.",Financial Analysis,Managing Yourself,Analytics,Finance & Accounting,,,,,,,,