,Human Labels,,,,,,,Topics from different Embeddings,,,,
Extracts,Topic 1,Topic 2,Topic 3,Topic 4,Topic 5,Topic 6,Topic 7,Spacy (Keyword) [Word2Vec],Spacy (Semantic) [Word2Vec],SBert,Fast Text,Universal Sentence Encoder
You can make more friends in two months by becoming interested in other people than you can in two years by trying to get other people interested in you.,networking,communication,management,,,,,,,,,
"When dealing with people, remember you are not dealing with creatures of logic, but with creatures bristling with prejudice and motivated by pride and vanity.",diversity,communication,economy,psychology,,,,,,,Investigate Latter,
"Any fool can criticize, complain, and condemn—and most fools do. But it takes character and self-control to be understanding and forgiving.",ethics,behavioural science,psychology,personnel policies,,,,,,,,
"The only reason, for example, that you are not a rattlesnake is that your mother and father weren't rattlesnakes. You deserve very little credit for being what you are",ethics,behavioral science,personnel policies,generational issues,,,,,,,,
"So figure it out for yourself. Which would you rather have, an academic, theatrical victory or a person’s good will? You can seldom have both.”",ethics,psychology,managing yourself,leadership,decision making,,,,,,,
Lack of concentration of effort. The “jack-of-all-trades” seldom is good at any. Concentrate all of your efforts on one definite chief aim.,management,education,startegic planing,startegic thinking,managing yourself,,,,,,,
"Money is shy and elusive. It must be wooed and won by methods not unlike those used by a determined lover, in pursuit of the girl of his choice.",behavioural science,ethics,psychology,,,,,,,,,
"The average lawn is an interesting beast: people plant it, then douse it with artificial fertilizers and dangerous pesticides to make it grow and to keep it uniform-all so that they can hack and mow what they encouraged to grow. And woe to the small yellow flower that rears its head!",sustainability,risk management,globalisation,diversity,leadership,,,,,,,
"Schumacher posited that people must make a serious shift in what they consider to be wealth and progress: ""Ever-bigger machines, entailing ever-bigger concentrations of economic power and exerting ever-greater violence against the environment, do not represent progress: they are a denial of wisdom.",technology,economy,wisdom,technology,,,,,,,,
"But ultimately a regulation is a signal of design failure. In fact, it is what we call a license to harm: a permit issued by a government to an industry so that it may dispense sickness, destruction, and death at an “acceptable” rate.",ethics,government,stress,conflict,government,,,,,,,
"Why talk about what we want? That is childish. Absurd. Of course, you are interested in what you want. You are eternally interested in it. But no one else is. The rest of us are just like you: we are interested in what we want.",communication,ethics,psychology,behavioural science,generational issues,,,,,,,
"Instead of condemning people, let’s try to understand them. Let’s try to figure out why they do what they do. That’s a lot more profitable and intriguing than criticism; and it breeds sympathy, tolerance and kindness. “To know all is to forgive all.”",behavioural science,psychology,ethics,leadership,,,,,,,,
"The chronic kicker, even the most violent critic, will frequently soften and be subdued in the presence of a patient, sympathetic listener— a listener who will be silent while the irate fault-finder dilates like a king cobra and spews the poison out of his system.",communication,risk management,conflict,psychology,ethics,,,,,,,
"John Wanamaker, founder of the stores that bear his name, once confessed: ""I learned thirty years ago that it is foolish to scold. I have enough trouble overcoming my own limitations without fretting over the fact that God has not seen fit to distribute evenly the gift of intelligence.",education,behavioural science,psychology,communication,,,,,,,,
"Buddha said: ‘Hatred is never ended by hatred but by love,’ and a misunderstanding is never ended by an argument but by tact, diplomacy, conciliation and a sympathetic desire to see the other person’s viewpoint.",psychology,policy,behavioral science,psychology,generational issues,,,,,,,
"I had listened intently. I had listened because I was genuinely interested. And he felt it. Naturally that pleased him. That kind of listening is one of the highest compliments we can pay anyone. “Few human beings,” wrote Jack Woodford in Strangers in Love, “few human beings are proof against the implied flattery of rapt attention.”",philosophy,psychology,leadership,leading teams,behavioral science,motivating people,,,,,,
"I asked him why he had chosen us over the others. He paused for a moment and then he said: ‘I think it was because managers in the other companies spoke on the phone in a cold, business-like manner, which made me feel like just another business transaction. Your voice sounded as if you were glad to hear from me … that you really wanted me to be part of your organization.",business,organizational culture,psychology,behavioural science,Corporate Communications,communication,,,,,,
"People who can put themselves in the place of other people, who can understand the workings of their minds, need never worry about what the future has in store for them.” If out of reading this book you get just one thing – an increased tendency to think always in terms of other people’s point of view, and see things from their angle – if you get that one thing out of this book, it may easily prove to be one of the building blocks of your career.",career planning,psychology,decision making,behavioural science,,,,,,,,
"Instead of condemning people, let’s try to understand them. Let’s try to figure out why they do what they do. That’s a lot more profitable and intriguing than criticism; and it breeds sympathy, tolerance and kindness. “To know all is to forgive all.” As Dr. Johnson said: “God himself, sir, does not propose to judge man until the end of his days.” Why should you and I?",communication,crisis communication,behavioural science,conflict,,,,,,,,
"The reason why rivers and seas receive the homage of a hundred mountain streams is that they keep below them. Thus they are able to reign over all the mountain streams. So the sage, wishing to be above men, putteth himself below them; wishing to be before them, he putteth himself behind them. Thus, though his place be above men, they do not feel his weight; though his place be before them, they do not count it an injury.",diversity,economy,ethics,behavioural science,psychology,,,,,,,
"Neville recommends at the end of every day, before you go to sleep, to think through the events of the day. If any events or moments did not go the way you wanted, replay them in your mind in a way that thrills you. As you recreate those events in your mind exactly as you want, you are cleaning up your frequency from the day and you are emitting a new signal and frequency for tomorrow. You have intentionally created new picture for your future. It is never too late to change the pictures.",ethics,productivity,behavioural science,health,psychology,ledership,self growth,,,,,
"“The Henry Ford of the late 20th century was Bill Gates. Just as Ford revolutionised the transportation industry by creating a car that almost anyone could afford and drive, Bill Gates transformed the computer industry by designing software that enabled everybody - not just the specialised technocrats - to be able to use computers, and later making the personal computer a virtual necessity in every office, school and home. This resulted in Bill Gates accruing billions of dollars and becoming the richest man in America.”",founders,It,design,market,leadership,,,,,,,
"faith is the starting point of all accumulation of riches! faith is the basis of all “miracles,” and all mysteries which cannot be analyzed by the rules of science! faith is the only known antidote for failure! faith is the element, the “chemical” which, when mixed with prayer, gives one direct communication with Infinite Intelligence. faith is the element which transforms the ordinary vibration of thought, created by the finite mind of man, into the spiritual equivalent. faith is the only agency through which the cosmic force of Infinite Intelligence can be harnessed and used by man.",communication,spirituality,behavioral science,,,,,,,,,
"The process is simple and it involves using a piece of poster board plus different magazines, drawings, printouts of inspirational words, and glue. Cut out pictures and drawings that appeal to you and glue them to the board.Place the completed vision board in a location where it can be viewed several times a day.Vision boards can have different functions- They can be goal-oriented, or theme-related (a travel destination) or intuitive (you're not sure what you want so you just tear out pictures that appeal to you). Spend a few minutes sitting still and thinking about your intention before starting the creative process.",Self Improvement,,,,,,,,,,,
"We believe that we can change the things around us in accordance with our desires—we believe it because otherwise we can see no favourable outcome. We do not think of the outcome which generally comes to pass and is also favourable: we do not succeed in changing things in accordance with our desires, but gradually our desires change. The situation that we hoped to change because it was intolerable becomes unimportant to us. We have failed to surmount the obstacle, as we were absolutely determined to do, but life has taken us round it, led us beyond it, and then if we turn round to gaze into the distance of the past, we can barely see it, so imperceptible has it become.",ethics,psychology,behavioural science,leadership,managing up,,,,,,,
"There is some talk in science and popular culture about colonizing other planets, such as Mars or the moon. Part of this is just human nature: we are curious, exploring creatures. The idea of taming a new frontier has a compelling, even romantic, pull, like that of the moon itself. But the idea also provides rationalization for destruction, an expression of our hope that we’ll find a way to save ourselves if we trash our planet. To this speculation, we would respond: If you want the Mars experience, go to Chile and live in a typical copper mine. There are no animals, the landscape is hostile to humans, and it would be a tremendous challenge. Or, for a moonlike effect, go to the nickel mines of Ontario. Seriously,",diversity,communication,crisis communication,behavioral science,,,,,,,,
"The law of auto-suggestion, through which any person may rise to altitudes of achievement which stagger the imagination, is well described in the following verse: ""If you think you are beaten, you are, If you think you dare not, you don't If you like to win, but you think you can't, It is almost certain you won't. ""If you think you'll lose, you're lost For out of the world we find, Success begins with a fellow's will-It's all in the state of mind. ""If you think you are outclassed, you are, You've got to think high to rise, You've got to be sure of yourself before You can ever win a prize. ""Life's battles don't always go To the stronger or faster man, But sooner or later the man who wins Is the man WHO THINKS HE CAN!",ethics,behavioural science,Emotional Intelligence,,,,,,,,,
"First, the huge United States Steel Corporation was born in the mind of Charles M. Schwab, in the form of an IDEA he created through his IMAGINATION! Second, he mixed FAITH with his IDEA. Third, he formulated a PLAN for the transformation of his IDEA into physical and financial reality. Fourth, he put his plan into action with his famous speech at the University Club. Fifth, he applied, and followed-through on his PLAN with PERSISTENCE, and backed it with firm DECISION until it had been fully carried out. Sixth, he prepared the way for success by a BURNING DESIRE for success. If you are one of those who have often wondered how great fortunes are accumulated, this story of the creation of the United States Steel Corporation will be enlightening.",founders,decision making,market,Financial Management,,,,,,,,
"A lot of people feel like they’re victims in life, and they’ll often point to past events, perhaps growing up with an abusive parent or in a dysfunctional family. Most psychologists believe that about 85 percent of families are dysfunctional, so all of a sudden you’re not so unique. My parents were alcoholics. My dad abused me. My mother divorced him when I was six…I mean, that’s almost everybody’s story in some form or not. The real question is, what are you going to do now? What do you choose now? Because you can either keep focusing on that, or you can focus on what you want. And when people start focusing on what they want, what they don’t want falls away, and what they want expands, and the other part disappears.",ethics,generational issues,behavioural science,productivity,psychology,,,,,,,
"With the Information Age, globalization went into overdrive. Advances in computer and communications technology launched a new global era and redefined what it meant to be “connected.” Modern communications satellites meant the 1964 Summer Olympics in Tokyo could be watched in the United States for the first time. The World Wide Web and the Internet allowed someone in Germany to read about a breaking news story in Bolivia in real time. Someone wishing to travel from Boston, Massachusetts, to London, England, could do so in hours rather than the week or more it would have taken a hundred years ago. This digital revolution massively impacted economies across the world as well: they became more information-based and more interdependent. In the modern era, economic success or failure at one focal point of the global web can be felt in every major world economy.",Globalization,Technology,Economics,Emerging Markets,,,,,,,,
"Transitioning To Digital Leadership
Rethink the organization’s leadership model to include the concepts of innovation, growth, inclusion, teamwork, and collaboration.
Identify the likely digital leaders in the organization: Determine who can be the investors, pioneers, and transformers. 
Train potential leaders to understand the opportunity. Promote younger people into leadership faster.
Foster risk-taking and experimentation through leadership strategy. 
Move beyond traditional leadership training: Focus on leadership strategy, emphasizing culture, empowerment, risk-taking, knowledge sharing, exposure, matrix management, and building talent as guides.",Leadership Development,Leadership Transitions,Coaching,Strategy,Managing Organizations,Leadership & Managing People,,,,,,
"Bass also suggested that there were four different components of transformational leadership.Individualized Consideration: Intellectual Stimulation: Transformational leaders not only challenge the status quo; they also encourage creativity among followers. The leader encourages followers to explore new ways of doing things and new opportunities to learn. Transformational leadership also involves offering support and encouragement to individual followers. In order to foster supportive relationships, transformational leaders keep lines of communication open so that followers feel free to share ideas and so that leaders can offer direct recognition of the unique contributions of each follower.Inspirational Motivation: Transformational leaders have a clear vision that they are able to articulate to followers. These leaders are also able to help followers experience the same passion and motivation to fulfill these goals.
Idealized Influence: The transformational leader serve as a role model for followers. Because followers trust and respect the leader, they emulate this individual and internalize his or her ideals.",Leadership,Leadership Transitions,Communication,Motivating People,Influence,,,,,,,
"Psychology, mental health in particular, is one of the more recent areas of focus for AI. As AI lengthens its reach, it is becoming increasingly crucial for psychologists, therapists, and counselors to understand the existing capacity and future potential for the technology to transform mental healthcare. Luxton (2014) says that AI can simulate a practitioner, with capabilities beyond its human counterpart.
Indeed, the following examples of advanced technology perceive beyond our human senses to assess patients (Luxton, 2014):
Infrared imaging to recognize temperature changes
Facial recognition to confirm a patient’s identity
Optical sensing to analyze facial expression and eye blinking
Vocal analysis to perceive subtle differences in speech characteristics
Olfaction (smell) analysis to identify intoxication",Technology,Psychology,Technology,Innovation,Research and Development,,,,,,,
"Balance is the concept of visual equilibrium, and relates to our physical sense of balance. It is a reconciliation of opposing forces in a composition that results in visual stability. Most successful compositions achieve balance in one of two ways: symmetrically or asymmetrically. Balance in a three dimensional object is easy to understand; if balance isn't achieved, the object tips over. To understand balance in a two dimensional composition, we must use our imaginations to carry this three dimensional analogy forward to the flat surface. Symmetrical balance can be described as having equal ""weight"" on equal sides of a centrally placed fulcrum. It may also be referred to as formal balance. When the elements are arranged equally on either side of a central axis, the result is Bilateral symmetry. This axis may be horizontal or vertical. It is also possible to build formal balance by arranging elements equally around a central point, resulting in radial symmetry. There is a variant of symmetrical balance called approximate symmetry in which equivalent but not identical forms are arranged around the fulcrum line. Asymmetrical balance, also called informal balance, is more complex and difficult to envisage. It involves placement of objects in a way that will allow objects of varying visual weight to balance one another around a fulcrum point. This can be best imagined by envisioning a literal balance scale that can represent the visual ""weights"" that can be imagined in a two dimensional composition.
",Design,Principles,Creativity,Innovation,Balance,,,,,,,
"Money supply and interest rates are two of the major factors that affect demand for a currency. Both can be controlled by governments and their central banks, which use them as tools to manipulate their economy and their domestic currency.
In the UK, the Bank of England sets the official interest rate, known as the Bank of England base rate, which in turn influences the interest rate when you borrow money. The base rate is currently 0.1%, which is a historic low – in November 1979 it reached a peak of 17%.
The money supply means just what it says – it’s the total amount of money that’s in circulation in a country. If there’s a higher amount of a currency floating around, the value of that currency will decrease against foreign currencies and the exchange rate will dip. High money supply is also linked to low interest rates (again, because a larger supply means lower demand).
Lower interest rates, in turn, also tend to make a currency drop in value – because investors get low returns on investments in that currency. This may make low interest rates seem like bad news. But there’s another, longer-term angle that explains why governments may choose to lower interest rates: low rates mean that people borrow more and spend more, which should make the economy grow.
",Currency,Interpersonal Relations,Government,Globalization,Global Strategy,,,,,,,
"Strategy has been the primary building block of competitiveness over the past three decades, but in the future, the quest for sustainable advantage may well begin with the business model. While the convergence of information and communication technologies in the 1990s resulted in a short-lived fascination with business models, forces such as deregulation, technological change, globalization, and sustainability have rekindled interest in the concept today. Since 2006, the IBM Institute for Business Value’s biannual Global CEO Study has reported that senior executives across industries regard developing innovative business models as a major priority. A 2009 follow-up study reveals that seven out of 10 companies are engaging in business-model innovation, and an incredible 98% are modifying their business models to some extent. Business model innovation is undoubtedly here to stay. That isn’t surprising. The pressure to crack open markets in developing countries, particularly those at the middle and bottom of the pyramid, is driving a surge in business-model innovation. The economic slowdown in the developed world is forcing companies to modify their business models or create new ones. In addition, the rise of new technology-based and low-cost rivals is threatening incumbents, reshaping industries, and redistributing profits. Indeed, the ways by which companies create and capture value through their business models is undergoing a radical transformation worldwide.
",Business Model,Strategic Planning,Succession Planning,Innovation,Sustainibility,,,,,,,
"Awareness. An effort to build awareness of a product or service is the first step in the sales process. A successful awareness-building effort may help a prospect recognize a brand or product name or may ensure a company makes the shortlist for purchasing consideration.

Engagement. Engagement efforts build on an initial awareness campaign to deepen a consumer’s connection to a company or product. Marketing materials aimed at engagement may be longer (e.g. a whitepaper or video) compared to a more superficial awareness piece (e.g. direct mailer or radio advertisement).

Conversion. A conversion is the critical transition of a potential customer from an anonymous person to a known lead. For marketing teams, a conversion may be the completion of a web form, the instigation of a web chat, or a phone call to a customer service line.

Retention. Even after a purchase, a marketing team can help a business grow its repeat customers. The retention function of marketing helps maintain awareness and engagement after a sale. This may include email newsletters or invitations to webinars that help a consumer get more value from a product. The retention function of marketing is especially critical for subscription services.",Sales & Marketing,Communication,Sales,Customer Service,,,,,,,,
"
experts define a business model by specifying the main characteristics of a good one. For example, Harvard Business School’s Clay Christensen suggests that a business model should consist of four elements: a customer value proposition, a profit formula, key resources, and key processes. Such descriptions undoubtedly help executives evaluate business models, but they impose preconceptions about what they should look like and may constrain the development of radically different ones.
Our studies suggest that one component of a business model must be the choices that executives make about how the organization should operate—choices such as compensation practices, procurement contracts, location of facilities, extent of vertical integration, sales and marketing initiatives, and so on. Managerial choices, of course, have consequences. For instance, pricing (a choice) affects sales volume, which, in turn, shapes the company’s scale economies and bargaining power (both consequences). These consequences influence the company’s logic of value creation and value capture, so they too must have a place in the definition. In its simplest conceptualization, therefore, a business model consists of a set of managerial choices and the consequences of those choices.
",Business Model,Managing Organizations,Customer Service,Strategy,,,,,,,,
"Facebook, Amazon, Google, and other tech companies will inadvertently give rise to an ethical revolution in behavior scientists. The American Psychological Association’s formal code of ethics, developed shortly after the Nuremberg Code was written in response to the scientific atrocities of World War II, focuses mainly on academic research and clinical practice. But today psychologists do much more than that. With psychologists becoming more embedded in product development, a new code is needed to account for the unforeseen challenges of connected devices, large scale personal data collection, dissemination of misinformation, algorithmic bias, and mass surveillance. We will—we should—see the development of best practices and ethical guidelines around the contributions of behavioral scientists to technology design and development. Training in the new ethical code will become a requirement for social science degrees or to serve as an investigator in IRB-reviewed research. Companies that do not demonstrate adherence to these ethical standards won’t survive in the marketplace as consumers become wise to the ways in which technology can cause them harm. And practitioners who do not abide by the code of ethics will rightly be viewed as unqualified to contribute to design.
",Psychology,Communication,Ethics,Data,,,,,,,,
