Topics,Definition
Informal Leadership,"An informal leader is an individual within an organization who is worth listening to because of their perceived experience and reputation among peers. They influence the decisions of others, although they hold no formal position of authority and have no power over those who choose to follow their lead."
Innovation,Innovation is the practical implementation of ideas that result in the introduction of new goods or services or improvement in offering goods or services.
Intellectual Property,"Intellectual property is a category of property that includes intangible creations of the human intellect. There are many types of intellectual property, and some countries recognize more than others. The most well-known types are copyrights, patents, trademarks, and trade secrets."
International Business,"International business refers to the trade of goods, services, technology, capital and/or knowledge across national borders and at a global or transnational scale. It involves cross-border transactions of goods and services between two or more countries."
Internet,"The Internet is a vast network that connects computers all over the world. Through the Internet, people can share information and communicate from anywhere with an Internet connection."
IPO,An initial public offering or stock market launch is a public offering in which shares of a company are sold to institutional investors and usually also retail investors.
IT,"IT refers to anything related to computing technology, such as networking, hardware, software, the Internet, or the people that work with these technologies."
Job Search,"Job search or Job seeking or job searching is the act of looking for employment, due to unemployment, underemployment, discontent with a current position, or a desire for a better position."
Joint Ventures,"A joint venture is a business entity created by two or more parties, generally characterized by shared ownership, shared returns and risks, and shared governance"
Knowledge Management,"Knowledge management is the process of creating, sharing, using and managing the knowledge and information of an organization. It refers to a multidisciplinary approach to achieve organisational objectives by making the best use of knowledge."
Labor,"Labor, usually referred to as paid work, paid employment, or paid labour, refers to the socioeconomic relationship between a worker and an employer in which the worker sells their labour power under a formal or informal employment contract."
Leadership,"Leadership is both a research area, and a practical skill encompassing the ability of an individual, group or organization to ""lead"", influence or guide other individuals, teams, or entire organizations."
Leadership & Managing People,"A practical skill encompassing the ability of an individual, group or organization to ""lead"", influence or guide other individuals, teams, or entire organizations. Managing people is the ability to understand and know what each of their subordinate employee's tasks are and how to work with each employee in working toward successful completion of such tasks."
Leadership Development,"Leadership development is the process which helps expand the capacity of individuals to perform in leadership roles within organizations. Leadership roles are those that facilitate execution of an organization's strategy through building alignment, winning mindshare and growing the capabilities of others"
Leadership Transitions,"Leadership Transitions refers to significant change in a leader's role caused by promotion, secondment, changing organisations, merger, acquisition, restructure or returning from maternity/paternity/career leave."
Leading Teams,"Leading teams involves providing guidance, instruction, direction and leadership to a group of individuals (the team) for the purpose of achieving a key result or group of aligned results. "
Managing Organizations,Organization management refers to the art of getting people together on a common platform to make them work towards a common predefined goal. Organization management enables the optimum use of resources through meticulous planning and control at the workplace.
Managing People,"People management is the process of training, motivating and directing employees to optimize workplace productivity and promote professional growth. Workplace leaders, such as team leads, managers and department heads use people management to oversee workflow and boost employee performance every day."
Managing Uncertainty,"Management of Uncertainty examines the necessity of living with technical and organizational uncertainties, or even taking advantage of them without losing the stability created by reducing uncertainty."
Managing Up,"Managing up refers to being the most effective employee you can be, creating value for your boss and your company."
Managing Yourself,"learning how to work with others in a productive and profitable way. It also means being focused on making your practice more profitable, keeping your clients happy, and doing excellent work. This takes constant self-monitoring and self-managing."
Manufacturing,"Manufacturing is the production of goods through the use of labor, machines, tools, and chemical or biological processing or formulation. It is the essence of secondary sector of the economy."
Market Research,"Market research is an organized effort to gather information about target markets and customers: know about them, starting with who they are. It is a very important component of business strategy and a major factor in maintaining competitiveness."
Marketing,"Marketing refers to activities a company undertakes to promote the buying or selling of a product, service, or good. It is one of the primary components of business management and commerce."
Meetings,"A meeting is when two or more people come together to discuss one or more topics, often in a formal or business setting, but meetings also occur in a variety of other environments."
Mergers & Acquisitions,"In corporate finance, mergers and acquisitions are transactions in which the ownership of companies, other business organizations, or their operating units are transferred or consolidated with other entities."
Mobile,"Mobile phone, cellular phone, cell phone, cellphone, handphone, or hand phone, sometimes shortened to simply mobile, cell or just phone, is a portable telephone that can make and receive calls over a radio frequency link while the user is moving within a telephone service area."
Motivating People,Motivating people is about moving people to act in a way that achieves a specific and immediate goal.
National Competitiveness,"The concept “national competitiveness” examines the ability of a national economy to grow. It is measured by a set of factors, policies, and institutions that determine a country's level of productivity."
Negotiations,Negotiation is a dialogue between two or more people or parties intended to reach a beneficial outcome over one or more issues where a conflict exists with respect to at least one of these issues.
Networking,"Networking is the exchange of information or services among individuals, groups, or institutions. Networking is a socioeconomic business activity by which businesspeople and entrepreneurs meet to form business relationships and to recognize, create, or act upon business opportunities, share information and seek potential partners for ventures."
Operations,"Operations are performance of a practical work or of something involving the practical application of principles or processes.Operations are the business activities that a firm engages in to convert materials into finished products or services, sell them to customers, and earn a profit."
Operations Management,"Operations Management is primarily concerned with planning, organizing and supervising in the contexts of production, manufacturing or the provision of services."
Organizational Culture,"Organizational Culture is the collection of values, expectations, and practices that guide and inform the actions of all team members. Think of it as the collection of traits that make your company what it is."
Organizational Structure,"Organizational Structure is a way or method by which. organizational activities are divided, organized and coordinated. The organizations created the structures to coordinate the. activities of work factors and control the member performance. Organizational structure is shown in organizational chart."
Performance Measurement,"Performance measurement is the process of collecting, analyzing and/or reporting information regarding the performance of an individual, group, organization, system or component."
Personnel Policies,"Personnel Policies are the rules that govern how to deal with a human resources or personnel related situation. They are guidelines to decision making that help keep the system as fair and unbiased as possible.
"
Policy,"A policy is a deliberate system of principles to guide decisions and achieve rational outcomes. A policy is a statement of intent, and is implemented as a procedure or protocol."
Presentations,"A presentation conveys information from a speaker to an audience. Presentations are typically demonstrations, introduction, lecture, or speech meant to inform, persuade, inspire, motivate, build goodwill, or present a new idea/product."
Pricing,"Pricing is the process whereby a business sets the price at which it will sell its products and services, and may be part of the business's marketing plan."
Product Development,Product development typically refers to all of the stages involved in bringing a product from concept or idea through market release and beyond.
Productivity,"Productivity is the efficiency of production of goods or services expressed by some measure. Measurements of productivity are often expressed as a ratio of an aggregate output to a single input or an aggregate input used in a production process, i.e. output per unit of input, typically over a specific period of time."
Professional Transitions,Professional Transitions refers to the process by which an individual changes from one job to another within the same job family; and it may also refer to a more dramatic career change from one occupational category to an entirely different one.
Project Management,Project Management is the process of leading the work of a team to achieve goals and meet success criteria at a specified time.
Psychology,"Psychology is the science of mind and behavior. Psychology includes the study of conscious and unconscious phenomena, as well as feeling and thought. It is an academic discipline of immense scope."
Public Relations,The professional maintenance of a favourable public image by a company or other organization or a famous person is called Public Relations. The state of the relationship between a company or other organization or a famous person and the public.
Public-Private Partnerships,"A public–private partnership is a cooperative arrangement between two or more public and private sectors, typically of a long-term nature. In other words, it involves government and business that work together to complete a project and/or to provide services to the population"
Race,A race is a grouping of humans based on shared physical or social qualities into categories generally viewed as distinct by society
Receiving Feedback,"Receiving Feedback is receiving helpful information or criticism that is taken from someone to understand what can be done to improve a performance, product, etc. Hear the person out, and listen to what they are really saying, not what you assume they will say."
Recession,"Recession is a period of temporary economic decline during which trade and industrial activity are reduced, generally identified by a fall in GDP in two successive quarters."
Regulation,"Regulation is the management of complex systems according to a set of rules and trends. In systems theory, these types of rules exist in various fields of biology and society, but the term has slightly different meanings according to context."
Reorganization,"Reorganization is the action or process of changing the way in which something is organized.In Business, Reorganisation is the process of reorganising an organisation facing financial difficulty in order to revitalise it. Restructuring means changing the structure or even ownership of an organisation through mergers, consolidation, or by selling it. Reorganisation is an important step for a company because it offers potential to capitalise on new opportunities and increase profits."
Research & Development,"Research and development, known in Europe as research and technological development, is the set of innovative activities undertaken by corporations or governments in developing new services or products and improving existing ones."
Retirement,Retirement is the withdrawal from one's position or occupation or from one's active working life. A person may also semi-retire by reducing work hours or workload. Many people choose to retire when they are old or incapable of doing their job.
Risk Management,"Risk management is the identification, evaluation, and prioritization of risks followed by coordinated and economical application of resources to minimize, monitor, and control the probability or impact of unfortunate events or to maximize the realization of opportunities."
Sales,Sales are activities related to selling or the number of goods sold in a given targeted time period. The delivery of a service for a cost is also considered a sale
Sales & Marketing,"Sales include “operations and activities involved in promoting and selling goods or services.” Marketing includes “the process or technique of promoting, selling, and distributing a product or service.”"
Security & Privacy,"Security is about the safeguarding of data and protection against the unauthorized access of data, whereas privacy is about the safeguarding of user identity."
Sexual Orientation,"Sexual orientation is an enduring pattern of romantic or sexual attraction to persons of the opposite sex or gender, the same sex or gender, or to both sexes or more than one gender."
Shared Value,Shared Value or organizational values are usually developed by the organization's leadership and then adopted by the other members of the organization. The values are shared and followed by all members of the organization when acting on behalf of the organization
Social Enterprise,"Social enterprises are businesses that trade to intentionally tackle social problems, improve communities, provide people access to employment and training, or help the environment."
Social Platforms,"Social Platforms or Social media are interactive technologies that allow the creation or sharing/exchange of information, ideas, career interests, and other forms of expression via virtual communities and networks"
Social Responsibility,Social responsibility is an ethical framework and suggests that an individual has an obligation to work and cooperate with other individuals and organizations for the benefit of society at large.
Strategic Planning,"Strategic planning is an organization's process of defining its strategy, or direction, and making decisions on allocating its resources to pursue this strategy. It may also extend to control mechanisms for guiding the implementation of the strategy."
Strategic Thinking,Strategic thinking is defined as a mental or thinking process applied by an individual in the context of achieving a goal or set of goals in a game or other endeavor.
Strategy,Strategy is a general plan to achieve one or more long-term or overall goals under conditions of uncertainty.
Strategy Execution,"Strategy Execution is the implementation of a strategic plan in an effort to reach organizational goals. It comprises the daily structures, systems, and operational goals that set your team up for success."
Stress,"stress is a feeling of emotional strain and pressure. Stress is a type of psychological pain. Small amounts of stress may be desired, beneficial, and even healthy. Excessive amounts of stress, however, may lead to bodily harm. Stress can be external and related to the environment, but may also be caused by internal perceptions that cause an individual to experience anxiety or other negative emotions surrounding a situation, such as pressure, discomfort, etc., which they then deem stressful."
Succession Planning,"Succession planning is a process for identifying and developing new leaders who can replace old leaders when they leave, retire or die. Here the planning is usually a close process, so that those who have been selected are not likely to know that they are on a succession list or chat."
Supply Chain,"A supply chain is a network between a company and its suppliers to produce and distribute a specific product to the final buyer. This network includes different activities, people, entities, information, and resources. The supply chain also represents the steps it takes to get the product or service from its original state to the customer."
Sustainability,Sustainability is the capacity to maintain in an ongoing way across various domains of life.
Talent Management,"Talent management is a constant process that involves attracting and retaining high-quality employees, developing their skills, and continuously motivating them to improve their performance.The primary purpose of talent management is to create a motivated workforce who will stay with your company in the long run."
Technology,"Technology is the sum of techniques, skills, methods, and processes used in the production of goods or services or in the accomplishment of objectives, such as scientific investigation."
Time Management,"Time management is the process of planning and exercising conscious control of time spent on specific activities, especially to increase effectiveness, efficiency, and productivity."
Transparency,"Transparency, as used in science, engineering, business, the humanities and in other social contexts, is operating in such a way that it is easy for others to see what actions are performed. Transparency implies openness, communication, and accountability."
Venture Capital,"Venture capital is a form of private equity financing that is provided by venture capital firms or funds to startups, early-stage, and emerging companies that have been deemed to have high growth potential or which have demonstrated high growth."
Work-Life Balance,Work–life balance is the equilibrium between personal life and career work
Workspaces,"Workspace refers to small premises provided, often by local authorities or economic development agencies, to help new businesses to establish themselves. These typically provide not only physical space and utilities but also administrative services and links to support and finance organizations, as well as peer support among the tenants. A continuum of sophistication ranges through categories such as 'managed workspaces', 'business incubators' and 'business and employment co-operatives'. In cities, they are often set up in buildings that are disused but which the local authority wishes to retain as a landmark. At the larger end of the spectrum are business parks, virtual offices, technology parks and science parks."